{
  "buckets": [
    {
      "aggregate": {
        "bbox": {
          "max": [
            16500.0,
            11550.0
          ],
          "min": [
            2450.0,
            3500.0
          ]
        },
        "count_by_type": {
          "INSERT": 5,
          "LINE": 5
        },
        "entity_count": 10,
        "hatch_area_sum_mm2": 0.0,
        "insert_by_block": {
          "GRID-BUBBLE": 5
        },
        "length_sum_mm": 47000.0,
        "text_count": 5,
        "text_hash": "16b0f5dfa89101a2"
      },
      "layer": "X-GRID",
      "space": "MODEL"
    },
    {
      "aggregate": {
        "bbox": {
          "max": [
            84100.0,
            59400.0
          ],
          "min": [
            0.0,
            -194.815825
          ]
        },
        "count_by_type": {
          "INSERT": 1
        },
        "entity_count": 1,
        "hatch_area_sum_mm2": 0.0,
        "insert_by_block": {
          "X-TITLE": 1
        },
        "length_sum_mm": 0.0,
        "text_count": 2,
        "text_hash": "02d42f7c87e9a063"
      },
      "layer": "X-TITLE",
      "space": "MODEL"
    }
  ],
  "file_sha256": "b3c3caa2bd5ca2426bdd26300a6902b7f127637c31c91c8f26a5e1babe84998b",
  "producer": {
    "name": "engine.ezdxf",
    "version": "fixtures-gen/0.1.0+ezdxf/1.4.4"
  },
  "schema_version": "0.1",
  "totals": {
    "bbox": {
      "max": [
        84100.0,
        59400.0
      ],
      "min": [
        0.0,
        -194.815825
      ]
    },
    "count_by_type": {
      "INSERT": 6,
      "LINE": 5
    },
    "entity_count": 11,
    "hatch_area_sum_mm2": 0.0,
    "insert_by_block": {
      "GRID-BUBBLE": 5,
      "X-TITLE": 1
    },
    "length_sum_mm": 47000.0,
    "text_count": 7,
    "text_hash": "71424455db060745"
  }
}
