{
  "buckets": [
    {
      "aggregate": {
        "bbox": {
          "max": [
            6500.0,
            3300.0
          ],
          "min": [
            0.0,
            0.0
          ]
        },
        "count_by_type": {
          "HATCH": 9,
          "SOLID": 5
        },
        "entity_count": 14,
        "hatch_area_sum_mm2": 7040000.0,
        "insert_by_block": {},
        "length_sum_mm": 0.0,
        "text_count": 0,
        "text_hash": "da39a3ee5e6b4b0d"
      },
      "layer": "A-HATCH",
      "space": "MODEL"
    }
  ],
  "file_sha256": "dce1fe05d500f80cbf2a542d0c9e702bf14bba4765fb0141e78db8c0d0b18c8a",
  "producer": {
    "name": "engine.ezdxf",
    "version": "fixtures-gen/0.1.0+ezdxf/1.4.4"
  },
  "schema_version": "0.1",
  "totals": {
    "bbox": {
      "max": [
        6500.0,
        3300.0
      ],
      "min": [
        0.0,
        0.0
      ]
    },
    "count_by_type": {
      "HATCH": 9,
      "SOLID": 5
    },
    "entity_count": 14,
    "hatch_area_sum_mm2": 7040000.0,
    "insert_by_block": {},
    "length_sum_mm": 0.0,
    "text_count": 0,
    "text_hash": "da39a3ee5e6b4b0d"
  }
}
